,Name of movie,Year of relase,Watchtime,Movie Rating,Metascore,Vote,Gross,Description,Director,Stars
656,Ratsasan,2018,170,8.3,^^^^^^,"45,858",*****,A sub-inspector sets out in pursuit of a mysterious serial killer who targets teen school girls and murders them brutally.,Ram Kumar,"['Vishnu Vishal', 'Amala Paul', 'Radha Ravi', 'Sangili Murugan']"
657,Đảo Kinh Hoàng,2010,138,8.2,63,"1,329,661",$128.01M,"In 1954, a U.S. Marshal investigates the disappearance of a murderer who escaped from a hospital for the criminally insane.",Martin Scorsese,"['Leonardo DiCaprio', 'Emily Mortimer', 'Mark Ruffalo', 'Ben Kingsley']"
658,Giác Quan Thứ Sáu,1999,107,8.2,64,"998,434",$293.51M,"A frightened, withdrawn Philadelphia boy who communicates with spirits seeks the help of a disheartened child psychologist.",M. Night Shyamalan,"['Bruce Willis', 'Haley Joel Osment', 'Toni Collette', 'Olivia Williams']"
659,The Father,I 2020,97,8.2,88,"159,340",*****,"A man refuses all assistance from his daughter as he ages. As he tries to make sense of his changing circumstances, he begins to doubt his loved ones, his own mind and even the fabric of his reality.",Florian Zeller,"['Anthony Hopkins', 'Olivia Colman', 'Mark Gatiss', 'Olivia Williams']"
660,Quái Vật Biến Hình,1982,109,8.2,57,"430,478",$13.78M,A research team in Antarctica is hunted by a shape-shifting alien that assumes the appearance of its victims.,John Carpenter,"['Kurt Russell', 'Wilford Brimley', 'Keith David', 'Richard Masur']"
661,Phố Tàu,1974,130,8.2,92,"330,168",$8.49M,"A private detective hired to expose an adulterer in 1930s Los Angeles finds himself caught up in a web of deceit, corruption, and murder.",Roman Polanski,"['Jack Nicholson', 'Faye Dunaway', 'John Huston', 'Perry Lopez']"
662,Bí Mật Los Angeles,1997,138,8.2,91,"586,795",$64.62M,"As corruption grows in 1950s Los Angeles, three policemen - one strait-laced, one brutal, and one sleazy - investigate a series of murders with their own brand of justice.",Curtis Hanson,"['Kevin Spacey', 'Russell Crowe', 'Guy Pearce', 'Kim Basinger']"
663,Bí Mật Sau Ánh Mắt,2009,129,8.2,80,"211,575",$6.39M,A retired legal counselor writes a novel hoping to find closure for one of his past unresolved homicide cases and for his unreciprocated love with his superior - both of which still haunt him decades later.,Juan José Campanella,"['Ricardo Darín', 'Soledad Villamil', 'Pablo Rago', 'Carla Quevedo']"
664,Drishyam,2015,163,8.2,^^^^^^,"86,741",$0.74M,"Desperate measures are taken by a man who tries to save his family from the dark side of the law, after they commit an unexpected crime.",Nishikant Kamat,"['Ajay Devgn', 'Shriya Saran', 'Tabu', 'Rajat Kapoor']"
665,Lã Sinh Môn,1950,88,8.2,98,"170,319",$0.10M,"The rape of a bride and the murder of her samurai husband are recalled from the perspectives of a bandit, the bride, the samurai's ghost and a woodcutter.",Akira Kurosawa,"['Toshirô Mifune', 'Machiko Kyô', 'Masayuki Mori', 'Takashi Shimura']"
666,Andhadhun,2018,139,8.2,^^^^^^,"95,483",$1.37M,"A series of mysterious events change the life of a blind pianist, who must now report a crime that he should technically know nothing of.",Sriram Raghavan,"['Tabu', 'Ayushmann Khurrana', 'Radhika Apte', 'Anil Dhawan']"
667,Lần Theo Dấu Vết,2013,153,8.1,70,"726,949",$61.00M,"When Keller Dover's daughter and her friend go missing, he takes matters into his own hands as the police pursue multiple leads and the pressure mounts.",Denis Villeneuve,"['Hugh Jackman', 'Jake Gyllenhaal', 'Viola Davis', 'Melissa Leo']"
668,Cô Gái Mất Tích,2014,149,8.1,79,"992,118",$167.77M,"With his wife's disappearance having become the focus of an intense media circus, a man sees the spotlight turned on him when it's suspected that he may not be innocent.",David Fincher,"['Ben Affleck', 'Rosamund Pike', 'Neil Patrick Harris', 'Tyler Perry']"
669,Harry Potter và Bảo Bối Tử Thần: Phần 2,2011,130,8.1,85,"884,208",$381.01M,"Harry, Ron, and Hermione search for Voldemort's remaining Horcruxes in their effort to destroy the Dark Lord as the final battle rages on at Hogwarts.",David Yates,"['Daniel Radcliffe', 'Emma Watson', 'Rupert Grint', 'Michael Gambon']"
670,Hồi Ức Kẻ Sát Nhân,2003,131,8.1,82,"189,211",$0.01M,"In a small Korean province in 1986, two detectives struggle with the case of multiple young women being found raped and murdered by an unknown culprit.",Bong Joon Ho,"['Song Kang-ho', 'Kim Sang-kyung', 'Roe-ha Kim', 'Jae-ho Song']"
671,Rebecca,1940,130,8.1,86,"138,819",$4.36M,A self-conscious woman juggles adjusting to her new role as an aristocrat's wife and avoiding being intimidated by his first wife's spectral presence.,Alfred Hitchcock,"['Laurence Olivier', 'Joan Fontaine', 'George Sanders', 'Judith Anderson']"
672,Người Thứ Ba,1949,104,8.1,97,"173,262",$0.45M,"Pulp novelist Holly Martins travels to shadowy, postwar Vienna, only to find himself investigating the mysterious death of an old friend, Harry Lime.",Carol Reed,"['Orson Welles', 'Joseph Cotten', 'Alida Valli', 'Trevor Howard']"
673,Ba Sắc Màu: Đỏ,1994,99,8.1,100,"104,914",$4.04M,A model discovers a retired judge is keen on invading people's privacy.,Krzysztof Kieslowski,"['Irène Jacob', 'Jean-Louis Trintignant', 'Frédérique Feder', 'Jean-Pierre Lorit']"
674,Les diaboliques,1955,117,8.1,^^^^^^,"66,746",$1.09M,The wife and mistress of a loathed school principal plan to murder him with what they believe is the perfect alibi.,Henri-Georges Clouzot,"['Simone Signoret', 'Véra Clouzot', 'Paul Meurisse', 'Charles Vanel']"
675,Article 15,2019,130,8.1,^^^^^^,"34,540",*****,"In the rural heartlands of India, an upright police officer sets out on a crusade against violent caste-based crimes and discrimination.",Anubhav Sinha,"['Ayushmann Khurrana', 'Nassar', 'Manoj Pahwa', 'Kumud Mishra']"
676,Talvar,2015,132,8.1,^^^^^^,"36,053",$0.34M,An experienced investigator confronts several conflicting theories about the perpetrators of a violent double homicide.,Meghna Gulzar,"['Irrfan Khan', 'Konkona Sen Sharma', 'Neeraj Kabi', 'Sohum Shah']"
677,A Wednesday,2008,104,8.1,^^^^^^,"79,591",*****,A retiring police officer reminisces about the most astounding day of his career. About a case that was never filed but continues to haunt him in his memories - the case of a man and a Wednesday.,Neeraj Pandey,"['Anupam Kher', 'Naseeruddin Shah', 'Veerendra Saxena', 'Mahesh Kanual']"
678,The Tashkent Files,2019,134,8.1,^^^^^^,"34,579",*****,"Revolves around the mysterious death of India's 2nd Prime Minister Shri Lal Bahadur Shastri and attempts to uncover if he had actually died a natural death, or, as alleged, was assassinated.",Vivek Agnihotri,"['Shweta Basu Prasad', 'Mithun Chakraborty', 'Naseeruddin Shah', 'Pankaj Tripathi']"
679,Người Tình Mất Tích,2012,122,8.1,^^^^^^,"63,569",$1.04M,"A pregnant woman's search for her missing husband takes her from London to Kolkata, but everyone she questions denies having ever met him.",Sujoy Ghosh,"['Vidya Balan', 'Parambrata Chattopadhyay', 'Indraneil Sengupta', 'Nawazuddin Siddiqui']"
680,Tội Phạm Nhân Bản 2049,2017,164,8.0,81,"584,925",$92.05M,"Young Blade Runner K's discovery of a long-buried secret leads him to track down former Blade Runner Rick Deckard, who's been missing for thirty years.",Denis Villeneuve,"['Harrison Ford', 'Ryan Gosling', 'Ana de Armas', 'Dave Bautista']"
681,Cuộc Đời Forrest Gump,1994,142,8.8,82,"2,095,669",$330.25M,"The presidencies of Kennedy and Johnson, the Vietnam War, the Watergate scandal and other historical events unfold from the perspective of an Alabama man with an IQ of 75, whose only desire is to be reunited with his childhood sweetheart.",Robert Zemeckis,"['Tom Hanks', 'Robin Wright', 'Gary Sinise', 'Sally Field']"
682,Cuộc Sống Tươi Đẹp,1997,116,8.6,59,"700,475",$57.60M,"When an open-minded Jewish waiter and his son become victims of the Holocaust, he uses a perfect mixture of will, humor, and imagination to protect his son from the dangers around their camp.",Roberto Benigni,"['Roberto Benigni', 'Nicoletta Braschi', 'Giorgio Cantarini', 'Giustino Durano']"
683,Cuộc Sống Tươi Đẹp,1946,130,8.6,89,"466,123",*****,An angel is sent from Heaven to help a desperately frustrated businessman by showing him what life would have been like if he had never existed.,Frank Capra,"['James Stewart', 'Donna Reed', 'Lionel Barrymore', 'Thomas Mitchell']"
684,Sita Ramam,2022,163,8.6,^^^^^^,"55,375",*****,"An orphan soldier, Lieutenant Ram's life changes, after he gets a letter from a girl named Sita. He meets her and love blossoms between them. When he comes back to his camp in Kashmir,After he gets caught in jail, he sends a letter to Sita which won't reach her.",Hanu Raghavapudi,"['Dulquer Salmaan', 'Mrunal Thakur', 'Rashmika Mandanna', 'Sumanth']"
685,Chuyện Tình Thế Chiến,1942,102,8.5,100,"575,656",$1.02M,A cynical expatriate American cafe owner struggles to decide whether or not to help his former lover and her fugitive husband escape the Nazis in French Morocco.,Michael Curtiz,"['Humphrey Bogart', 'Ingrid Bergman', 'Paul Henreid', 'Claude Rains']"
686,Rạp Chiếu Bóng Thiên Đường,1988,155,8.5,80,"263,740",$11.99M,A filmmaker recalls his childhood when falling in love with the pictures at the cinema of his home village and forms a deep friendship with the cinema's projectionist.,Giuseppe Tornatore,"['Philippe Noiret', 'Enzo Cannavale', 'Antonella Attili', 'Isa Danieli']"
687,Thời Hiện Đại,1936,87,8.5,96,"244,767",$0.16M,The Tramp struggles to live in modern industrial society with the help of a young homeless woman.,Charles Chaplin,"['Charles Chaplin', 'Paulette Goddard', 'Henry Bergman', 'Tiny Sandford']"
688,Ánh Sáng Đô Thị,1931,87,8.5,99,"186,277",$0.02M,"With the aid of a wealthy erratic tippler, a dewy-eyed tramp who has fallen in love with a sightless flower girl accumulates money to be able to help her medically.",Charles Chaplin,"['Charles Chaplin', 'Virginia Cherrill', 'Florence Lee', 'Harry Myers']"
689,96,II 2018,158,8.5,^^^^^^,"32,232",*****,Two high school sweethearts meet at a reunion after 22 years and reminisce about their past.,C. Prem Kumar,"['Vijay Sethupathi', 'Adithya Bhaskar', 'Trisha Krishnan', 'Gouri Kishan']"
690,Tên Cậu Là Gì?,2016,106,8.4,79,"274,007",$5.02M,"Two strangers find themselves linked in a bizarre way. When a connection forms, will distance be the only thing to keep them apart?",Makoto Shinkai,"['Ryûnosuke Kamiki', 'Mone Kamishiraishi', 'Ryô Narita', 'Aoi Yûki']"
691,Dil Bechara,2020,101,8.4,^^^^^^,"131,819",*****,"The emotional journey of two hopelessly-in-love youngsters; a young girl, Kizie, who is suffering from cancer; and Manny, a boy Kizie meets at a support group.",Mukesh Chhabra,"['Sushant Singh Rajput', 'Sanjana Sanghi', 'Sahil Vaid', 'Saswata Chatterjee']"
692,Chàng Will Tốt Bụng,1997,126,8.3,70,"981,645",$138.43M,"Will Hunting, a janitor at M.I.T., has a gift for mathematics, but needs help from a psychologist to find direction in his life.",Gus Van Sant,"['Robin Williams', 'Matt Damon', 'Ben Affleck', 'Stellan Skarsgård']"
693,Tia Nắng Vĩnh Cửu Của Tâm Hồn Tinh Khiết,2004,108,8.3,89,"1,015,653",$34.40M,"When their relationship turns sour, a couple undergoes a medical procedure to have each other erased from their memories for ever.",Michel Gondry,"['Jim Carrey', 'Kate Winslet', 'Tom Wilkinson', 'Gerry Robert Byrne']"
694,Hát Dưới Mưa,1952,103,8.3,99,"245,301",$8.82M,A silent film star falls for a chorus girl just as he and his delusionally jealous screen partner are trying to make the difficult transition to talking pictures in 1920s Hollywood.,"Directors:Stanley Donen, Gene Kelly","['Gene Kelly', ""Donald O'Connor"", 'Debbie Reynolds', 'Jean Hagen']"
695,Le fabuleux destin d'Amélie Poulain,2001,122,8.3,69,"761,499",$33.23M,"Amélie is an innocent and naive girl in Paris with her own sense of justice. She decides to help those around her and, along the way, discovers love.",Jean-Pierre Jeunet,"['Audrey Tautou', 'Mathieu Kassovitz', 'Rufus', 'Lorella Cravotta']"
696,Quay Cuồng,1958,128,8.3,100,"405,683",$3.20M,"A former San Francisco police detective juggles wrestling with his personal demons and becoming obsessed with the hauntingly beautiful woman he has been hired to trail, who may be deeply disturbed.",Alfred Hitchcock,"['James Stewart', 'Kim Novak', 'Barbara Bel Geddes', 'Tom Helmore']"
697,Căn Hộ Tình Yêu,1960,125,8.3,94,"183,698",$18.60M,"A Manhattan insurance clerk tries to rise in his company by letting its executives use his apartment for trysts, but complications and a romance of his own ensue.",Billy Wilder,"['Jack Lemmon', 'Shirley MacLaine', 'Fred MacMurray', 'Ray Walston']"
698,Chhichhore,2019,143,8.3,^^^^^^,"56,237",$0.90M,"A tragic incident forces Anirudh, a middle-aged man, to take a trip down memory lane and reminisce his college days along with his friends, who were labelled as losers.",Nitesh Tiwari,"['Sushant Singh Rajput', 'Shraddha Kapoor', 'Varun Sharma', 'Prateik Babbar']"
699,Cuốn Theo Chiều Gió,1939,238,8.2,97,"318,355",$198.68M,American motion picture classic in which a manipulative woman and a roguish man conduct a turbulent romance during the Civil War and Reconstruction periods.,"Directors:Victor Fleming, George Cukor, Sam Wood","['Clark Gable', 'Vivien Leigh', 'Thomas Mitchell', ""Barbara O'Neil""]"
700,Some Like It Hot,1959,121,8.2,98,"269,917",$25.00M,"After two male musicians witness a mob hit, they flee the state in an all-female band disguised as women, but further complications set in.",Billy Wilder,"['Marilyn Monroe', 'Tony Curtis', 'Jack Lemmon', 'George Raft']"
701,Bí Mật Sau Ánh Mắt,2009,129,8.2,80,"211,575",$6.39M,A retired legal counselor writes a novel hoping to find closure for one of his past unresolved homicide cases and for his unreciprocated love with his superior - both of which still haunt him decades later.,Juan José Campanella,"['Ricardo Darín', 'Soledad Villamil', 'Pablo Rago', 'Carla Quevedo']"
702,Sống Chỉ Một Lần,2011,155,8.2,^^^^^^,"79,975",$3.11M,Three friends decide to turn their fantasy vacation into reality after one of their friends gets engaged.,Zoya Akhtar,"['Hrithik Roshan', 'Farhan Akhtar', 'Abhay Deol', 'Katrina Kaif']"
703,To Be or Not to Be,1942,99,8.2,86,"38,617",*****,"During the Nazi occupation of Poland, an acting troupe becomes embroiled in a Polish soldier's efforts to track down a German spy.",Ernst Lubitsch,"['Carole Lombard', 'Jack Benny', 'Robert Stack', 'Felix Bressart']"
704,Sherlock Jr.,1924,45,8.2,^^^^^^,"51,095",$0.98M,"A film projectionist longs to be a detective, and puts his meagre skills to work when he is framed by a rival for stealing his girlfriend's father's pocketwatch.",Buster Keaton,"['Buster Keaton', 'Kathryn McGuire', 'Joe Keaton', 'Erwin Connelly']"
705,Ngày Chuột Chũi,1993,101,8.1,72,"639,459",$70.91M,"A narcissistic, self-centered weatherman finds himself in a time loop on Groundhog Day, and the day keeps repeating until he gets it right.",Harold Ramis,"['Bill Murray', 'Andie MacDowell', 'Chris Elliott', 'Stephen Tobolowsky']"
706,Người Hầu Gái,2016,145,8.1,84,"151,897",$2.01M,"A woman is hired as a handmaiden to a Japanese heiress, but secretly she is involved in a plot to defraud her.",Park Chan-wook,"['Kim Min-hee', 'Ha Jung-woo', 'Cho Jin-woong', 'Moon So-ri']"
707,Bức Chân Dung Bị Thiêu Cháy,2019,122,8.1,95,"95,038",$3.76M,"On an isolated island in Brittany at the end of the eighteenth century, a female painter is obliged to paint a wedding portrait of a young woman.",Céline Sciamma,"['Noémie Merlant', 'Adèle Haenel', 'Luàna Bajrami', 'Valeria Golino']"
708,Before Sunrise,1995,101,8.1,77,"313,315",$5.54M,"A young man and woman meet on a train in Europe, and wind up spending one evening together in Vienna. Unfortunately, both know that this will probably be their only night together.",Richard Linklater,"['Ethan Hawke', 'Julie Delpy', 'Andrea Eckert', 'Hanno Pöschl']"
709,Giai Điệu Hạnh Phúc,1965,172,8.1,63,"239,728",$163.21M,A young novice is sent by her convent in 1930s Austria to become a governess to the seven children of a widowed naval officer.,Robert Wise,"['Julie Andrews', 'Christopher Plummer', 'Eleanor Parker', 'Richard Haydn']"
710,Tâm trạng khi yêu,2000,98,8.1,86,"153,249",$2.73M,"Two neighbors form a strong bond after both suspect extramarital activities of their spouses. However, they agree to keep their bond platonic so as not to commit similar wrongs.",Kar-Wai Wong,"['Tony Chiu-Wai Leung', 'Maggie Cheung', 'Siu Ping-Lam', ""Tung Cho 'Joe' Cheung""]"
711,Trước Lúc Hoàng Hôn,2004,80,8.1,90,"268,306",$5.82M,"Nine years after Jesse and Celine first met, they encounter each other again on the French leg of Jesse's book tour.",Richard Linklater,"['Ethan Hawke', 'Julie Delpy', 'Vernon Dobtcheff', 'Louise Lemoine Torrès']"
712,Rebecca,1940,130,8.1,86,"138,819",$4.36M,A self-conscious woman juggles adjusting to her new role as an aristocrat's wife and avoiding being intimidated by his first wife's spectral presence.,Alfred Hitchcock,"['Laurence Olivier', 'Joan Fontaine', 'George Sanders', 'Judith Anderson']"
713,The Best Years of Our Lives,1946,170,8.1,93,"65,908",$23.65M,"Three World War II veterans, two of them traumatized or disabled, return home to the American midwest to discover that they and their families have been irreparably changed.",William Wyler,"['Myrna Loy', 'Dana Andrews', 'Fredric March', 'Teresa Wright']"
714,Chuyện Xảy Ra Trong Đêm,1934,105,8.1,87,"105,574",$4.36M,"A renegade reporter trailing a young runaway heiress for a big story joins her on a bus heading from Florida to New York, and they end up stuck with each other when the bus leaves them behind at one of the stops.",Frank Capra,"['Clark Gable', 'Claudette Colbert', 'Walter Connolly', 'Roscoe Karns']"
715,Ba Sắc Màu: Đỏ,1994,99,8.1,100,"104,914",$4.04M,A model discovers a retired judge is keen on invading people's privacy.,Krzysztof Kieslowski,"['Irène Jacob', 'Jean-Louis Trintignant', 'Frédérique Feder', 'Jean-Pierre Lorit']"
716,Đôi Giày Đỏ,1948,135,8.1,^^^^^^,"36,156",$10.90M,A young ballet dancer is torn between the man she loves and her pursuit to become a prima ballerina.,"Directors:Michael Powell, Emeric Pressburger","['Anton Walbrook', 'Marius Goring', 'Moira Shearer', 'Robert Helpmann']"
717,Bá Vương Biệt Cơ,1993,171,8.1,83,"30,098",$5.22M,Two boys meet at an opera training school in Peking in 1924. Their resulting friendship will span nearly 70 years and will endure some of the most troublesome times in China's history.,Kaige Chen,"['Leslie Cheung', 'Fengyi Zhang', 'Gong Li', 'You Ge']"
718,Smultronstället,1957,91,8.1,88,"108,458",*****,"After living a life marked by coldness, an aging professor is forced to confront the emptiness of his existence.",Ingmar Bergman,"['Victor Sjöström', 'Bibi Andersson', 'Ingrid Thulin', 'Gunnar Björnstrand']"
719,Nhất Nhất,2000,173,8.1,94,"25,517",$1.14M,Each member of a middle-class Taipei family seeks to reconcile past and present relationships within their daily lives.,Edward Yang,"['Nien-Jen Wu', 'Elaine Jin', 'Issei Ogata', 'Kelly Lee']"
720,A Woman Under the Influence,1974,155,8.1,88,"26,149",$13.34M,"Although wife and mother Mabel is loved by her husband Nick, her mental illness places a strain on the marriage.",John Cassavetes,"['Gena Rowlands', 'Peter Falk', 'Fred Draper', 'Lady Rowlands']"
721,Sunrise: A Song of Two Humans,1927,94,8.1,95,"51,589",$0.54M,"A sophisticated urban woman seduces a farmer in the hopes that he will murder his neglected wife and join her in the city, but he ends up rekindling his romance with his wife when she discovers their scheme.",F.W. Murnau,"[""George O'Brien"", 'Janet Gaynor', 'Margaret Livingston', 'Bodil Rosing']"
722,Cuộc Săn Vàng,1925,95,8.1,^^^^^^,"112,478",$5.45M,"A prospector goes to the Klondike during the 1890s gold rush in hopes of making his fortune, and is smitten with a girl he sees in a dance hall.",Charles Chaplin,"['Charles Chaplin', 'Mack Swain', 'Tom Murray', 'Henry Bergman']"
723,Đèn Lồng Đỏ Treo Cao,1991,125,8.1,^^^^^^,"33,422",$2.60M,"A young woman becomes the fourth wife of a wealthy lord, and must learn to live with the strict rules and tensions within the household.",Yimou Zhang,"['Gong Li', 'Jingwu Ma', 'Saifei He', 'Cuifen Cao']"
724,Dil Chahta Hai,2001,183,8.1,^^^^^^,"73,107",$0.30M,"Three inseparable childhood friends are just out of college. Nothing comes between them - until they each fall in love, and their wildly different approaches to relationships creates tension.",Farhan Akhtar,"['Aamir Khan', 'Saif Ali Khan', 'Akshaye Khanna', 'Preity Zinta']"
725,Barfi!,2012,151,8.1,^^^^^^,"83,155",$2.80M,Three young people learn that love can neither be defined nor contained by society's definition of normal and abnormal.,Anurag Basu,"['Ranbir Kapoor', 'Priyanka Chopra Jonas', ""Ileana D'Cruz"", 'Saurabh Shukla']"
726,Rạp Xiếc,1928,72,8.1,90,"34,424",*****,The Tramp finds work and the girl of his dreams at a circus.,Charles Chaplin,"['Charles Chaplin', 'Merna Kennedy', 'Al Ernest Garcia', 'Harry Crocker']"
727,Những Kẻ Khờ Mộng Mơ,2016,128,8.0,94,"598,974",$151.10M,"While navigating their careers in Los Angeles, a pianist and an actress fall in love while attempting to reconcile their aspirations for the future.",Damien Chazelle,"['Ryan Gosling', 'Emma Stone', 'Rosemarie DeWitt', 'J.K. Simmons']"
728,Cô Dâu Công Chúa,1987,98,8.0,77,"431,278",$30.86M,"While home sick in bed, a young boy's grandfather reads him the story of a farmboy-turned-pirate who encounters numerous obstacles, enemies and allies in his quest to be reunited with his true love.",Rob Reiner,"['Cary Elwes', 'Mandy Patinkin', 'Robin Wright', 'Chris Sarandon']"
729,Hạnh Phúc Ảo,2013,126,8.0,91,"622,285",$25.57M,"In a near future, a lonely writer develops an unlikely relationship with an operating system designed to meet his every need.",Spike Jonze,"['Joaquin Phoenix', 'Amy Adams', 'Scarlett Johansson', 'Rooney Mara']"
730,Aladdin,1992,90,8.0,86,"426,784",$217.35M,A kindhearted street urchin and a power-hungry Grand Vizier vie for a magic lamp that has the power to make their deepest wishes come true.,"Directors:Ron Clements, John Musker","['Scott Weinger', 'Robin Williams', 'Linda Larkin', 'Jonathan Freeman']"
731,Kẻ Đánh Cắp Giấc Mơ,2010,148,8.8,74,"2,370,473",$292.58M,"A thief who steals corporate secrets through the use of dream-sharing technology is given the inverse task of planting an idea into the mind of a C.E.O., but his tragic past may doom the project and his team to disaster.",Christopher Nolan,"['Leonardo DiCaprio', 'Joseph Gordon-Levitt', 'Elliot Page', 'Ken Watanabe']"
732,Ma Trận,1999,136,8.7,73,"1,925,666",$171.48M,"When a beautiful stranger leads computer hacker Neo to a forbidding underworld, he discovers the shocking truth--the life he knows is the elaborate deception of an evil cyber-intelligence.","Directors:Lana Wachowski, Lilly Wachowski","['Keanu Reeves', 'Laurence Fishburne', 'Carrie-Anne Moss', 'Hugo Weaving']"
733,Chiến Tranh Giữa Các Vì Sao Tập 5: Đế Chế Phản Công,1980,124,8.7,82,"1,300,791",$290.48M,"After the Rebels are brutally overpowered by the Empire on the ice planet Hoth, Luke Skywalker begins Jedi training with Yoda, while his friends are pursued across the galaxy by Darth Vader and bounty hunter Boba Fett.",Irvin Kershner,"['Mark Hamill', 'Harrison Ford', 'Carrie Fisher', 'Billy Dee Williams']"
734,Hố Đen Tử Thần,2014,169,8.6,74,"1,855,005",$188.02M,A team of explorers travel through a wormhole in space in an attempt to ensure humanity's survival.,Christopher Nolan,"['Matthew McConaughey', 'Anne Hathaway', 'Jessica Chastain', 'Mackenzie Foy']"
735,Chiến Tranh Giữa Các Vì Sao Tập 4: Niềm Hi Vọng Mới,1977,121,8.6,90,"1,373,220",$322.74M,"Luke Skywalker joins forces with a Jedi Knight, a cocky pilot, a Wookiee and two droids to save the galaxy from the Empire's world-destroying battle station, while also attempting to rescue Princess Leia from the mysterious Darth Vader.",George Lucas,"['Mark Hamill', 'Harrison Ford', 'Carrie Fisher', 'Alec Guinness']"
736,Kẻ Hủy Diệt 2: Ngày Phán Xét,1991,137,8.6,75,"1,106,715",$204.84M,"A cyborg, identical to the one who failed to kill Sarah Connor, must now protect her 10-year old son John from an even more advanced and powerful cyborg.",James Cameron,"['Arnold Schwarzenegger', 'Linda Hamilton', 'Edward Furlong', 'Robert Patrick']"
737,Ảo Thuật Gia Đấu Trí,2006,130,8.5,66,"1,342,825",$53.09M,"After a tragic accident, two stage magicians in 1890s London engage in a battle to create the ultimate illusion while sacrificing everything they have to outwit each other.",Christopher Nolan,"['Christian Bale', 'Hugh Jackman', 'Scarlett Johansson', 'Michael Caine']"
738,Trở Về Tương Lai,1985,116,8.5,87,"1,215,564",$210.61M,"Marty McFly, a 17-year-old high school student, is accidentally sent 30 years into the past in a time-traveling DeLorean invented by his close friend, the maverick scientist Doc Brown.",Robert Zemeckis,"['Michael J. Fox', 'Christopher Lloyd', 'Lea Thompson', 'Crispin Glover']"
739,Quái Vật Không Gian,1979,117,8.5,89,"889,517",$78.90M,The crew of a commercial spacecraft encounter a deadly lifeform after investigating an unknown transmission.,Ridley Scott,"['Sigourney Weaver', 'Tom Skerritt', 'John Hurt', 'Veronica Cartwright']"
