,Name of movie,Year of relase,Watchtime,Movie Rating,Metascore,Vote,Gross,Description,Director,Stars
0,Chúa Tể Của Những Chiếc Nhẫn: Sự Quay Trở Lại Của Nhà Vua,2003,201,9.0,94,"1,858,282",$377.85M,Gandalf and Aragorn lead the World of Men against Sauron's army to draw his gaze from Frodo and Sam as they approach Mount Doom with the One Ring.,Peter Jackson,"['Elijah Wood', 'Viggo Mortensen', 'Ian McKellen', 'Orlando Bloom']"
1,777 Charlie,2022,164,8.9,^^^^^^,"33,142",*****,Dharma is stuck in a rut with his negative and lonely lifestyle and spends each day in the comfort of his loneliness. A pup named Charlie enters his life and gives him a new perspective towards it.,Kiranraj K,"['Rakshit Shetty', 'Charlie', 'Sangeetha Sringeri', 'Raj B. Shetty']"
2,Kẻ Đánh Cắp Giấc Mơ,2010,148,8.8,74,"2,370,473",$292.58M,"A thief who steals corporate secrets through the use of dream-sharing technology is given the inverse task of planting an idea into the mind of a C.E.O., but his tragic past may doom the project and his team to disaster.",Christopher Nolan,"['Leonardo DiCaprio', 'Joseph Gordon-Levitt', 'Elliot Page', 'Ken Watanabe']"
3,Chúa Tể Của Những Chiếc Nhẫn: Những Người Bạn Của Nhẫn,2001,178,8.8,92,"1,887,641",$315.54M,A meek Hobbit from the Shire and eight companions set out on a journey to destroy the powerful One Ring and save Middle-earth from the Dark Lord Sauron.,Peter Jackson,"['Elijah Wood', 'Ian McKellen', 'Orlando Bloom', 'Sean Bean']"
4,"Thiện, Ác, Tà",1966,161,8.8,90,"766,605",$6.10M,A bounty hunting scam joins two men in an uneasy alliance against a third in a race to find a fortune in gold buried in a remote cemetery.,Sergio Leone,"['Clint Eastwood', 'Eli Wallach', 'Lee Van Cleef', 'Aldo Giuffrè']"
5,Chúa Tể Của Những Chiếc Nhẫn: Hai Tòa Tháp,2002,179,8.8,87,"1,677,925",$342.55M,"While Frodo and Sam edge closer to Mordor with the help of the shifty Gollum, the divided fellowship makes a stand against Sauron's new ally, Saruman, and his hordes of Isengard.",Peter Jackson,"['Elijah Wood', 'Ian McKellen', 'Viggo Mortensen', 'Orlando Bloom']"
6,Chiến Tranh Giữa Các Vì Sao Tập 5: Đế Chế Phản Công,1980,124,8.7,82,"1,300,791",$290.48M,"After the Rebels are brutally overpowered by the Empire on the ice planet Hoth, Luke Skywalker begins Jedi training with Yoda, while his friends are pursued across the galaxy by Darth Vader and bounty hunter Boba Fett.",Irvin Kershner,"['Mark Hamill', 'Harrison Ford', 'Carrie Fisher', 'Billy Dee Williams']"
7,Hố Đen Tử Thần,2014,169,8.6,74,"1,855,005",$188.02M,A team of explorers travel through a wormhole in space in an attempt to ensure humanity's survival.,Christopher Nolan,"['Matthew McConaughey', 'Anne Hathaway', 'Jessica Chastain', 'Mackenzie Foy']"
8,Chiến Tranh Giữa Các Vì Sao Tập 4: Niềm Hi Vọng Mới,1977,121,8.6,90,"1,373,220",$322.74M,"Luke Skywalker joins forces with a Jedi Knight, a cocky pilot, a Wookiee and two droids to save the galaxy from the Empire's world-destroying battle station, while also attempting to rescue Princess Leia from the mysterious Darth Vader.",George Lucas,"['Mark Hamill', 'Harrison Ford', 'Carrie Fisher', 'Alec Guinness']"
9,Vùng Đất Linh Hồn,2001,125,8.6,96,"771,525",$10.06M,"During her family's move to the suburbs, a sullen 10-year-old girl wanders into a world ruled by gods, witches, and spirits, and where humans are changed into beasts.",Hayao Miyazaki,"['Daveigh Chase', 'Suzanne Pleshette', 'Miyu Irino', 'Rumi Hiiragi']"
10,Võ Sĩ Giác Đấu,2000,155,8.5,67,"1,511,029",$187.71M,A former Roman General sets out to exact vengeance against the corrupt emperor who murdered his family and sent him into slavery.,Ridley Scott,"['Russell Crowe', 'Joaquin Phoenix', 'Connie Nielsen', 'Oliver Reed']"
11,Trở Về Tương Lai,1985,116,8.5,87,"1,215,564",$210.61M,"Marty McFly, a 17-year-old high school student, is accidentally sent 30 years into the past in a time-traveling DeLorean invented by his close friend, the maverick scientist Doc Brown.",Robert Zemeckis,"['Michael J. Fox', 'Christopher Lloyd', 'Lea Thompson', 'Crispin Glover']"
12,Vua Sư Tử,1994,88,8.5,88,"1,066,590",$422.78M,"Lion prince Simba and his father are targeted by his bitter uncle, who wants to ascend the throne himself.","Directors:Roger Allers, Rob Minkoff","['Matthew Broderick', 'Jeremy Irons', 'James Earl Jones', 'Whoopi Goldberg']"
13,Kaithi,2019,145,8.5,^^^^^^,"34,058",*****,"Dilli, an ex-convict, endeavours to meet his daughter for the first time after leaving prison. However, his attempts are interrupted due to a drug raid planned by Inspector Bejoy.",Lokesh Kanagaraj,"['Karthi', 'Narain', 'Arjun Das', 'George Maryan']"
14,Avengers: Hồi Kết,2019,181,8.4,78,"1,145,628",$858.37M,"After the devastating events of Avengers: Cuộc Chiến Vô Cực (2018), the universe is in ruins. With the help of remaining allies, the Avengers assemble once more in order to reverse Thanos' actions and restore balance to the universe.","Directors:Anthony Russo, Joe Russo","['Robert Downey Jr.', 'Chris Evans', 'Mark Ruffalo', 'Chris Hemsworth']"
15,Indiana Jones Và Chiếc Rương Thánh Tích,1981,115,8.4,85,"973,133",$248.16M,"In 1936, archaeologist and adventurer Indiana Jones is hired by the U.S. government to find the Ark of the Covenant before the Nazis can obtain its awesome powers.",Steven Spielberg,"['Harrison Ford', 'Karen Allen', 'Paul Freeman', 'John Rhys-Davies']"
16,Avengers: Cuộc Chiến Vô Cực,2018,149,8.4,68,"1,093,086",$678.82M,The Avengers and their allies must be willing to sacrifice all in an attempt to defeat the powerful Thanos before his blitz of devastation and ruin puts an end to the universe.,"Directors:Anthony Russo, Joe Russo","['Robert Downey Jr.', 'Chris Hemsworth', 'Mark Ruffalo', 'Chris Evans']"
17,Người Nhện: Vũ Trụ Mới,2018,117,8.4,87,"539,908",$190.24M,"Teen Miles Morales becomes the Spider-Man of his universe, and must join with five spider-powered individuals from other dimensions to stop a threat for all realities.","Directors:Bob Persichetti, Peter Ramsey, Rodney Rothman","['Shameik Moore', 'Jake Johnson', 'Hailee Steinfeld', 'Mahershala Ali']"
18,Quái Vật Không Gian 2,1986,137,8.4,84,"723,108",$85.16M,"Fifty-seven years after surviving an apocalyptic attack aboard her space vessel by merciless space creatures, Officer Ripley awakens from hyper-sleep and tries to warn anyone who will listen about the predators.",James Cameron,"['Sigourney Weaver', 'Michael Biehn', 'Carrie Henn', 'Paul Reiser']"
19,Coco: Hội Ngộ Diệu Kỳ,I 2017,105,8.4,81,"517,136",$209.73M,"Aspiring musician Miguel, confronted with his family's ancestral ban on music, enters the Land of the Dead to find his great-great-grandfather, a legendary singer.","Directors:Lee Unkrich, Adrian Molina","['Anthony Gonzalez', 'Gael García Bernal', 'Benjamin Bratt', 'Alanna Ubach']"
20,Rô-bốt Biết Yêu,2008,98,8.4,95,"1,124,269",$223.81M,"In the distant future, a small waste-collecting robot inadvertently embarks on a space journey that will ultimately decide the fate of mankind.",Andrew Stanton,"['Ben Burtt', 'Elissa Knight', 'Jeff Garlin', 'Fred Willard']"
21,Công Chúa Mononoke,1997,134,8.4,76,"398,986",$2.38M,"On a journey to find the cure for a Tatarigami's curse, Ashitaka finds himself in the middle of a war between the forest gods and Tatara, a mining colony. In this quest he also meets San, the Mononoke Hime.",Hayao Miyazaki,"['Yôji Matsuda', 'Yuriko Ishida', 'Yûko Tanaka', 'Billy Crudup']"
22,Định Mệnh,2009,153,8.3,69,"1,462,765",$120.54M,"In Nazi-occupied France during World War II, a plan to assassinate Nazi leaders by a group of Jewish U.S. soldiers coincides with a theatre owner's vengeful plans for the same.",Quentin Tarantino,"['Brad Pitt', 'Diane Kruger', 'Eli Roth', 'Mélanie Laurent']"
23,2001: Chuyến Du Hành Không Gian,1968,149,8.3,84,"674,575",$56.95M,"After uncovering a mysterious artifact buried beneath the Lunar surface, a spacecraft is sent to Jupiter to find its origins - a spacecraft manned by two men and the supercomputer H.A.L. 9000.",Stanley Kubrick,"['Keir Dullea', 'Gary Lockwood', 'William Sylvester', 'Daniel Richter']"
24,Vút Bay,2009,96,8.3,88,"1,051,952",$293.00M,"78-year-old Carl Fredricksen travels to Paradise Falls in his house equipped with balloons, inadvertently taking a young stowaway.","Directors:Pete Docter, Bob Peterson","['Edward Asner', 'Jordan Nagai', 'John Ratzenberger', 'Christopher Plummer']"
25,Kantara,2022,148,8.3,^^^^^^,"90,059",*****,It involves culture of Kambala and Bhootha Kola. A human and nature conflict where Shiva is a rebel who defends his village and nature. A death leads to war between villagers and evil forces. Will he be able to regain peace in the village?,Rishab Shetty,"['Rishab Shetty', 'Kishore Kumar G.', 'Achyuth Kumar', 'Sapthami Gowda']"
26,Câu Chuyện Đồ Chơi,1995,81,8.3,96,"1,001,336",$191.80M,A cowboy doll is profoundly threatened and jealous when a new spaceman action figure supplants him as top toy in a boy's bedroom.,John Lasseter,"['Tom Hanks', 'Tim Allen', 'Don Rickles', 'Jim Varney']"
27,Chiến Tranh Giữa Các Vì Sao Tập 6: Sự Quay Trở Lại Của Jedi,1983,131,8.3,58,"1,061,163",$309.13M,"After a daring mission to rescue Han Solo from Jabba the Hutt, the Rebels dispatch to Endor to destroy the second Death Star. Meanwhile, Luke struggles to help Darth Vader back from the dark side without falling into the Emperor's trap.",Richard Marquand,"['Mark Hamill', 'Harrison Ford', 'Carrie Fisher', 'Billy Dee Williams']"
28,Lawrence Xứ Ả Rập,1962,218,8.3,100,"296,643",$44.82M,"The story of T.E. Lawrence, the English officer who successfully united and led the diverse, often warring, Arab tribes during World War I in order to fight the Turks.",David Lean,"[""Peter O'Toole"", 'Alec Guinness', 'Anthony Quinn', 'Jack Hawkins']"
29,Câu Chuyện Đồ Chơi 3,2010,103,8.3,92,"842,383",$415.00M,"The toys are mistakenly delivered to a day-care center instead of the attic right before Andy leaves for college, and it's up to Woody to convince the other toys that they weren't abandoned and to return home.",Lee Unkrich,"['Tom Hanks', 'Tim Allen', 'Joan Cusack', 'Ned Beatty']"
30,Bắc Tây Bắc,1959,136,8.3,98,"330,833",$13.28M,"A New York City advertising executive goes on the run after being mistaken for a government agent by a group of foreign spies, and falls for a woman whose loyalties he begins to doubt.",Alfred Hitchcock,"['Cary Grant', 'Eva Marie Saint', 'James Mason', 'Jessie Royce Landis']"
31,Người Nhện: Không Còn Nhà,2021,148,8.2,71,"768,301",$804.75M,"With Spider-Man's identity now revealed, Peter asks Doctor Strange for help. When a spell goes wrong, dangerous foes from other worlds start to appear, forcing Peter to discover what it truly means to be Spider-Man.",Jon Watts,"['Tom Holland', 'Zendaya', 'Benedict Cumberbatch', 'Jacob Batalon']"
32,Công Viên Kỷ Jura,1993,127,8.2,68,"997,230",$402.45M,A pragmatic paleontologist touring an almost complete theme park on an island in Central America is tasked with protecting a couple of kids after a power failure causes the park's cloned dinosaurs to run loose.,Steven Spielberg,"['Sam Neill', 'Laura Dern', 'Jeff Goldblum', 'Richard Attenborough']"
33,Indiana Jones Và Cuộc Thập Tự Chinh Cuối Cùng,1989,127,8.2,65,"760,884",$197.17M,"In 1938, after his father goes missing while pursuing the Holy Grail, Indiana Jones finds himself up against the Nazis again to stop them from obtaining its powers.",Steven Spielberg,"['Harrison Ford', 'Sean Connery', 'Alison Doody', 'Denholm Elliott']"
34,Lâu Đài Di Động Của Howl,2004,119,8.2,80,"401,003",$4.71M,"When an unconfident young woman is cursed with an old body by a spiteful witch, her only chance of breaking the spell lies with a self-indulgent yet insecure young wizard and his companions in his legged, walking castle.",Hayao Miyazaki,"['Chieko Baisho', 'Takuya Kimura', 'Tatsuya Gashûin', 'Akihiro Miwa']"
35,Những Mảnh Ghép Cảm Xúc,I 2015,95,8.2,94,"721,547",$356.46M,"After young Riley is uprooted from her Midwest life and moved to San Francisco, her emotions - Joy, Fear, Anger, Disgust and Sadness - conflict on how best to navigate a new city, house, and school.","Directors:Pete Docter, Ronnie Del Carmen","['Amy Poehler', 'Bill Hader', 'Lewis Black', 'Mindy Kaling']"
36,Đi Tìm Nemo,2003,100,8.2,90,"1,051,316",$380.84M,"After his son is captured in the Great Barrier Reef and taken to Sydney, a timid clownfish sets out on a journey to bring him home.","Directors:Andrew Stanton, Lee Unkrich","['Albert Brooks', 'Ellen DeGeneres', 'Alexander Gould', 'Willem Dafoe']"
37,Chén Thánh Phiêu Lưu Ký,1975,91,8.2,91,"545,645",$1.23M,"King Arthur and his Knights of the Round Table embark on a surreal, low-budget search for the Holy Grail, encountering many, very silly obstacles.","Directors:Terry Gilliam, Terry Jones","['Graham Chapman', 'John Cleese', 'Eric Idle', 'Terry Gilliam']"
38,Cuộc Đào Thoát Vĩ Đại,1963,172,8.2,86,"246,748",$12.10M,Allied prisoners of war plan for several hundred of their number to escape from a German camp during World War II.,John Sturges,"['Steve McQueen', 'James Garner', 'Richard Attenborough', 'Charles Bronson']"
39,Thanh Gươm Diệt Quỷ: Chuyến Tàu Vô Tận,2020,117,8.2,72,"60,394",$47.70M,"After his family was brutally murdered and his sister turned into a demon, Tanjiro Kamado's journey as a demon slayer began. Tanjiro and his comrades embark on a new mission aboard the Mugen Train, on track to despair.",Haruo Sotozaki,"['Natsuki Hanae', 'Akari Kitô', 'Yoshitsugu Matsuoka', 'Hiro Shimono']"
40,Cầu Sông Kwai,1957,161,8.2,87,"222,810",$44.91M,"British POWs are forced to build a railway bridge across the river Kwai for their Japanese captors in occupied Burma, not knowing that the allied forces are planning a daring commando raid through the jungle to destroy it.",David Lean,"['William Holden', 'Alec Guinness', 'Jack Hawkins', 'Sessue Hayakawa']"
41,Klaus - Câu Chuyện Giáng Sinh,2019,96,8.2,65,"161,675",*****,"A simple act of kindness always sparks another, even in a frozen, faraway place. When Smeerensburg's new postman, Jesper, befriends toymaker Klaus, their gifts melt an age-old feud and deliver a sleigh full of holiday traditions.","Directors:Sergio Pablos, Carlos Martínez López","['Jason Schwartzman', 'J.K. Simmons', 'Rashida Jones', 'Will Sasso']"
42,Kho Báu Ở Sierra Madre,1948,126,8.2,98,"126,074",$5.01M,Two down-on-their-luck Americans searching for work in 1920s Mexico convince an old prospector to help them mine for gold in the Sierra Madre Mountains.,John Huston,"['Humphrey Bogart', 'Walter Huston', 'Tim Holt', 'Bruce Bennett']"
43,Le salaire de la peur,1953,131,8.2,85,"62,306",*****,"In a decrepit South American village, four men are hired to transport an urgent nitroglycerine shipment without the equipment that would make it safe.",Henri-Georges Clouzot,"['Yves Montand', 'Charles Vanel', 'Peter van Eyck', 'Folco Lulli']"
44,Dersu Uzala,1975,142,8.2,^^^^^^,"30,882",*****,The Russian army sends an explorer on an expedition to the snowy Siberian wilderness where he makes friends with a seasoned local hunter.,Akira Kurosawa,"['Maksim Munzuk', 'Yuriy Solomin', 'Mikhail Bychkov', 'Vladimir Khrulyov']"
45,Khách Sạn Đế Vương,2014,99,8.1,88,"820,329",$59.10M,"A writer encounters the owner of an aging high-class hotel, who tells him of his early years serving as a lobby boy in the hotel's glorious years under an exceptional concierge.",Wes Anderson,"['Ralph Fiennes', 'F. Murray Abraham', 'Mathieu Amalric', 'Adrien Brody']"
46,Max Điên: Con Đường Tử Thần,2015,120,8.1,90,"1,012,360",$154.06M,"In a post-apocalyptic wasteland, a woman rebels against a tyrannical ruler in search for her homeland with the aid of a group of female prisoners, a psychotic worshiper, and a drifter named Max.",George Miller,"['Tom Hardy', 'Charlize Theron', 'Nicholas Hoult', 'Zoë Kravitz']"
47,Harry Potter và Bảo Bối Tử Thần: Phần 2,2011,130,8.1,85,"884,208",$381.01M,"Harry, Ron, and Hermione search for Voldemort's remaining Horcruxes in their effort to destroy the Dark Lord as the final battle rages on at Hogwarts.",David Yates,"['Daniel Radcliffe', 'Emma Watson', 'Rupert Grint', 'Michael Gambon']"
48,Cướp Biển Vùng Caribê: Lời Nguyền Của Tàu Ngọc Trai Đen,2003,143,8.1,63,"1,136,098",$305.41M,"Blacksmith Will Turner teams up with eccentric pirate ""Captain"" Jack Sparrow to save his love, the governor's daughter, from Jack's former pirate allies, who are now undead.",Gore Verbinski,"['Johnny Depp', 'Geoffrey Rush', 'Orlando Bloom', 'Keira Knightley']"
49,Hàm Cá Mập,1975,124,8.1,87,"613,183",$260.00M,"When a killer shark unleashes chaos on a beach community off Cape Cod, it's up to a local sheriff, a marine biologist, and an old seafarer to hunt the beast down.",Steven Spielberg,"['Roy Scheider', 'Robert Shaw', 'Richard Dreyfuss', 'Lorraine Gary']"
50,Vùng Đất Linh Hồn,2001,125,8.6,96,"771,525",$10.06M,"During her family's move to the suburbs, a sullen 10-year-old girl wanders into a world ruled by gods, witches, and spirits, and where humans are changed into beasts.",Hayao Miyazaki,"['Daveigh Chase', 'Suzanne Pleshette', 'Miyu Irino', 'Rumi Hiiragi']"
51,Vua Sư Tử,1994,88,8.5,88,"1,066,590",$422.78M,"Lion prince Simba and his father are targeted by his bitter uncle, who wants to ascend the throne himself.","Directors:Roger Allers, Rob Minkoff","['Matthew Broderick', 'Jeremy Irons', 'James Earl Jones', 'Whoopi Goldberg']"
52,Mộ Đom Đóm,1988,89,8.5,94,"280,848",*****,A young boy and his little sister struggle to survive in Japan during World War II.,Isao Takahata,"['Tsutomu Tatsumi', 'Ayano Shiraishi', 'Akemi Yamaguchi', 'Yoshiko Shinohara']"
53,Người Nhện: Vũ Trụ Mới,2018,117,8.4,87,"539,908",$190.24M,"Teen Miles Morales becomes the Spider-Man of his universe, and must join with five spider-powered individuals from other dimensions to stop a threat for all realities.","Directors:Bob Persichetti, Peter Ramsey, Rodney Rothman","['Shameik Moore', 'Jake Johnson', 'Hailee Steinfeld', 'Mahershala Ali']"
54,Coco: Hội Ngộ Diệu Kỳ,I 2017,105,8.4,81,"517,136",$209.73M,"Aspiring musician Miguel, confronted with his family's ancestral ban on music, enters the Land of the Dead to find his great-great-grandfather, a legendary singer.","Directors:Lee Unkrich, Adrian Molina","['Anthony Gonzalez', 'Gael García Bernal', 'Benjamin Bratt', 'Alanna Ubach']"
55,Rô-bốt Biết Yêu,2008,98,8.4,95,"1,124,269",$223.81M,"In the distant future, a small waste-collecting robot inadvertently embarks on a space journey that will ultimately decide the fate of mankind.",Andrew Stanton,"['Ben Burtt', 'Elissa Knight', 'Jeff Garlin', 'Fred Willard']"
56,Tên Cậu Là Gì?,2016,106,8.4,79,"274,007",$5.02M,"Two strangers find themselves linked in a bizarre way. When a connection forms, will distance be the only thing to keep them apart?",Makoto Shinkai,"['Ryûnosuke Kamiki', 'Mone Kamishiraishi', 'Ryô Narita', 'Aoi Yûki']"
57,Công Chúa Mononoke,1997,134,8.4,76,"398,986",$2.38M,"On a journey to find the cure for a Tatarigami's curse, Ashitaka finds himself in the middle of a war between the forest gods and Tatara, a mining colony. In this quest he also meets San, the Mononoke Hime.",Hayao Miyazaki,"['Yôji Matsuda', 'Yuriko Ishida', 'Yûko Tanaka', 'Billy Crudup']"
58,Vút Bay,2009,96,8.3,88,"1,051,952",$293.00M,"78-year-old Carl Fredricksen travels to Paradise Falls in his house equipped with balloons, inadvertently taking a young stowaway.","Directors:Pete Docter, Bob Peterson","['Edward Asner', 'Jordan Nagai', 'John Ratzenberger', 'Christopher Plummer']"
59,Câu Chuyện Đồ Chơi,1995,81,8.3,96,"1,001,336",$191.80M,A cowboy doll is profoundly threatened and jealous when a new spaceman action figure supplants him as top toy in a boy's bedroom.,John Lasseter,"['Tom Hanks', 'Tim Allen', 'Don Rickles', 'Jim Varney']"
60,Câu Chuyện Đồ Chơi 3,2010,103,8.3,92,"842,383",$415.00M,"The toys are mistakenly delivered to a day-care center instead of the attic right before Andy leaves for college, and it's up to Woody to convince the other toys that they weren't abandoned and to return home.",Lee Unkrich,"['Tom Hanks', 'Tim Allen', 'Joan Cusack', 'Ned Beatty']"
61,Lâu Đài Di Động Của Howl,2004,119,8.2,80,"401,003",$4.71M,"When an unconfident young woman is cursed with an old body by a spiteful witch, her only chance of breaking the spell lies with a self-indulgent yet insecure young wizard and his companions in his legged, walking castle.",Hayao Miyazaki,"['Chieko Baisho', 'Takuya Kimura', 'Tatsuya Gashûin', 'Akihiro Miwa']"
62,Những Mảnh Ghép Cảm Xúc,I 2015,95,8.2,94,"721,547",$356.46M,"After young Riley is uprooted from her Midwest life and moved to San Francisco, her emotions - Joy, Fear, Anger, Disgust and Sadness - conflict on how best to navigate a new city, house, and school.","Directors:Pete Docter, Ronnie Del Carmen","['Amy Poehler', 'Bill Hader', 'Lewis Black', 'Mindy Kaling']"
63,Đi Tìm Nemo,2003,100,8.2,90,"1,051,316",$380.84M,"After his son is captured in the Great Barrier Reef and taken to Sydney, a timid clownfish sets out on a journey to bring him home.","Directors:Andrew Stanton, Lee Unkrich","['Albert Brooks', 'Ellen DeGeneres', 'Alexander Gould', 'Willem Dafoe']"
64,Thanh Gươm Diệt Quỷ: Chuyến Tàu Vô Tận,2020,117,8.2,72,"60,394",$47.70M,"After his family was brutally murdered and his sister turned into a demon, Tanjiro Kamado's journey as a demon slayer began. Tanjiro and his comrades embark on a new mission aboard the Mugen Train, on track to despair.",Haruo Sotozaki,"['Natsuki Hanae', 'Akari Kitô', 'Yoshitsugu Matsuoka', 'Hiro Shimono']"
65,Klaus - Câu Chuyện Giáng Sinh,2019,96,8.2,65,"161,675",*****,"A simple act of kindness always sparks another, even in a frozen, faraway place. When Smeerensburg's new postman, Jesper, befriends toymaker Klaus, their gifts melt an age-old feud and deliver a sleigh full of holiday traditions.","Directors:Sergio Pablos, Carlos Martínez López","['Jason Schwartzman', 'J.K. Simmons', 'Rashida Jones', 'Will Sasso']"
66,Chú Chuột Đầu Bếp,2007,111,8.1,96,"747,459",$206.45M,A rat who can cook makes an unusual alliance with a young kitchen worker at a famous Paris restaurant.,"Directors:Brad Bird, Jan Pinkava","['Brad Garrett', 'Lou Romano', 'Patton Oswalt', 'Ian Holm']"
67,Công Ty Quái Vật,2001,92,8.1,79,"917,047",$289.92M,"In order to power the city, monsters have to scare children so that they scream. However, the children are toxic to the monsters, and after a child gets through, two monsters realize things may not be what they think.","Directors:Pete Docter, David Silverman, Lee Unkrich","['Billy Crystal', 'John Goodman', 'Mary Gibbs', 'Steve Buscemi']"
68,Bí Kíp Luyện Rồng,2010,98,8.1,75,"747,612",$217.58M,"A hapless young Viking who aspires to hunt dragons becomes the unlikely friend of a young dragon himself, and learns there may be more to the creatures than he assumed.","Directors:Dean DeBlois, Chris Sanders","['Jay Baruchel', 'Gerard Butler', 'Christopher Mintz-Plasse', 'Craig Ferguson']"
69,Hàng Xóm Của Tôi Là Totoro,1988,86,8.1,86,"344,432",$1.11M,"When two girls move to the country to be near their ailing mother, they have adventures with the wondrous forest spirits who live nearby.",Hayao Miyazaki,"['Hitoshi Takagi', 'Noriko Hidaka', 'Chika Sakamoto', 'Shigesato Itoi']"
70,Người Máy Khổng Lồ,1999,86,8.1,85,"203,159",$23.16M,A young boy befriends a giant robot from outer space that a paranoid government agent wants to destroy.,Brad Bird,"['Eli Marienthal', 'Harry Connick Jr.', 'Jennifer Aniston', 'Vin Diesel']"
71,Dáng Hình Thanh Âm,2016,130,8.1,78,"85,094",*****,"A young man is ostracized by his classmates after he bullies a deaf girl to the point where she moves away. Years later, he sets off on a path for redemption.",Naoko Yamada,"['Miyu Irino', 'Saori Hayami', 'Aoi Yûki', 'Kenshô Ono']"
72,Mary Và Max,2009,92,8.1,^^^^^^,"178,904",*****,"A tale of friendship between two unlikely pen pals: Mary, a lonely, eight-year-old girl living in the suburbs of Melbourne, and Max, a forty-four-year old, severely obese man living in New York.",Adam Elliot,"['Toni Collette', 'Philip Seymour Hoffman', 'Eric Bana', 'Barry Humphries']"
73,Neon Genesis Evangelion: The End of Evangelion,1997,87,8.1,^^^^^^,"56,767",*****,Concurrent theatrical ending of the TV series Neon Genesis Evangelion (1995).,"Directors:Hideaki Anno, Kazuya Tsurumaki","['Megumi Ogata', 'Megumi Hayashibara', 'Yûko Miyamura', 'Kotono Mitsuishi']"
74,Những Đứa Con Của Sói,2012,117,8.1,71,"45,982",*****,"After her werewolf lover unexpectedly dies in an accident while hunting for food for their children, a young woman must find ways to raise the werewolf son and daughter that she had with him while keeping their trait hidden from society.",Mamoru Hosoda,"['Aoi Miyazaki', 'Takao Osawa', 'Haru Kuroki', 'Yukito Nishii']"
75,Phi Vụ Động Trời,2016,108,8.0,78,"505,877",$341.27M,"In a city of anthropomorphic animals, a rookie bunny cop and a cynical con artist fox must work together to uncover a conspiracy.","Directors:Byron Howard, Rich Moore, Jared Bush","['Ginnifer Goodwin', 'Jason Bateman', 'Idris Elba', 'Jenny Slate']"
76,Gia Đình Siêu Nhân,2004,115,8.0,90,"746,335",$261.44M,"While trying to lead a quiet suburban life, a family of undercover superheroes are forced into action to save the world.",Brad Bird,"['Craig T. Nelson', 'Samuel L. Jackson', 'Holly Hunter', 'Jason Lee']"
