,Name of movie,Year of relase,Watchtime,Movie Rating,Metascore,Vote,Gross,Description,Director,Stars
243,Băng Đảng Người Anh,1998,107,8.2,66,"587,288",$3.90M,"Eddy persuades his three pals to pool money for a vital poker game against a powerful local mobster, Hatchet Harry. Eddy loses, after which Harry gives him a week to pay back 500,000 pounds.",Guy Ritchie,"['Jason Flemyng', 'Dexter Fletcher', 'Nick Moran', 'Jason Statham']"
244,Gangs of Wasseypur,2012,321,8.2,89,"97,858",*****,"A clash between Sultan and Shahid Khan leads to the expulsion of Khan from Wasseypur, and ignites a deadly blood feud spanning three generations.",Anurag Kashyap,"['Manoj Bajpayee', 'Nawazuddin Siddiqui', 'Tigmanshu Dhulia', 'Richa Chadha']"
245,Bí Mật Los Angeles,1997,138,8.2,91,"586,795",$64.62M,"As corruption grows in 1950s Los Angeles, three policemen - one strait-laced, one brutal, and one sleazy - investigate a series of murders with their own brand of justice.",Curtis Hanson,"['Kevin Spacey', 'Russell Crowe', 'Guy Pearce', 'Kim Basinger']"
246,Z,1969,127,8.2,86,"29,494",$0.08M,The public murder of a prominent politician and doctor amid a violent demonstration is covered up by military and government officials. A tenacious magistrate is determined not to let them get away with it.,Costa-Gavras,"['Yves Montand', 'Irene Papas', 'Jean-Louis Trintignant', 'François Périer']"
247,Drishyam,2015,163,8.2,^^^^^^,"86,741",$0.74M,"Desperate measures are taken by a man who tries to save his family from the dark side of the law, after they commit an unexpected crime.",Nishikant Kamat,"['Ajay Devgn', 'Shriya Saran', 'Tabu', 'Rajat Kapoor']"
248,Lã Sinh Môn,1950,88,8.2,98,"170,319",$0.10M,"The rape of a bride and the murder of her samurai husband are recalled from the perspectives of a bandit, the bride, the samurai's ghost and a woodcutter.",Akira Kurosawa,"['Toshirô Mifune', 'Machiko Kyô', 'Masayuki Mori', 'Takashi Shimura']"
249,Cuộc Gọi Chết Người,1954,105,8.2,75,"177,929",$0.01M,A former tennis star arranges the murder of his adulterous wife.,Alfred Hitchcock,"['Ray Milland', 'Grace Kelly', 'Robert Cummings', 'John Williams']"
250,Nhà tù Shawshank,1994,142,9.3,81,"2,698,327",$28.34M,"Over the course of several years, two convicts form a friendship, seeking consolation and, eventually, redemption through basic compassion.",Frank Darabont,"['Tim Robbins', 'Morgan Freeman', 'Bob Gunton', 'William Sadler']"
251,Bố Già,1972,175,9.2,100,"1,872,611",$134.97M,The aging patriarch of an organized crime dynasty in postwar New York City transfers control of his clandestine empire to his reluctant youngest son.,Francis Ford Coppola,"['Marlon Brando', 'Al Pacino', 'James Caan', 'Diane Keaton']"
252,Hababam Sinifi,1975,87,9.2,^^^^^^,"41,256",*****,"Lazy, uneducated students share a very close bond. They live together in the dormitory, where they plan their latest pranks. When a new headmaster arrives, the students naturally try to overthrow him. A comic war of nitwits follows.",Ertem Egilmez,"['Kemal Sunal', 'Münir Özkul', 'Halit Akçatepe', 'Tarik Akan']"
253,Kỵ Sĩ Bóng Đêm,2008,152,9.0,84,"2,672,079",$534.86M,"When the menace known as the Joker wreaks havoc and chaos on the people of Gotham, Batman must accept one of the greatest psychological and physical tests of his ability to fight injustice.",Christopher Nolan,"['Christian Bale', 'Heath Ledger', 'Aaron Eckhart', 'Michael Caine']"
254,Bản Danh Sách Của Schindler,1993,195,9.0,95,"1,364,153",$96.90M,"In German-occupied Poland during World War II, industrialist Oskar Schindler gradually becomes concerned for his Jewish workforce after witnessing their persecution by the Nazis.",Steven Spielberg,"['Liam Neeson', 'Ralph Fiennes', 'Ben Kingsley', 'Caroline Goodall']"
255,Bố Già Phần II,1974,202,9.0,90,"1,279,832",$57.30M,"The early life and career of Vito Corleone in 1920s New York City is portrayed, while his son, Michael, expands and tightens his grip on the family crime syndicate.",Francis Ford Coppola,"['Al Pacino', 'Robert De Niro', 'Robert Duvall', 'Diane Keaton']"
256,12 Người Đàn Ông Giận Dữ,1957,96,9.0,97,"796,875",$4.36M,The jury in a New York City murder trial is frustrated by a single member whose skeptical caution forces them to more carefully consider the evidence before jumping to a hasty verdict.,Sidney Lumet,"['Henry Fonda', 'Lee J. Cobb', 'Martin Balsam', 'John Fiedler']"
257,Chúa Tể Của Những Chiếc Nhẫn: Sự Quay Trở Lại Của Nhà Vua,2003,201,9.0,94,"1,858,282",$377.85M,Gandalf and Aragorn lead the World of Men against Sauron's army to draw his gaze from Frodo and Sam as they approach Mount Doom with the One Ring.,Peter Jackson,"['Elijah Wood', 'Viggo Mortensen', 'Ian McKellen', 'Orlando Bloom']"
258,Chuyện Tào Lao,1994,154,8.9,94,"2,071,148",$107.93M,"The lives of two mob hitmen, a boxer, a gangster and his wife, and a pair of diner bandits intertwine in four tales of violence and redemption.",Quentin Tarantino,"['John Travolta', 'Uma Thurman', 'Samuel L. Jackson', 'Bruce Willis']"
259,777 Charlie,2022,164,8.9,^^^^^^,"33,142",*****,Dharma is stuck in a rut with his negative and lonely lifestyle and spends each day in the comfort of his loneliness. A pup named Charlie enters his life and gives him a new perspective towards it.,Kiranraj K,"['Rakshit Shetty', 'Charlie', 'Sangeetha Sringeri', 'Raj B. Shetty']"
260,Sàn Đấu Sinh Tử,1999,139,8.8,66,"2,143,216",$37.03M,An insomniac office worker and a devil-may-care soap maker form an underground fight club that evolves into much more.,David Fincher,"['Brad Pitt', 'Edward Norton', 'Meat Loaf', 'Zach Grenier']"
261,Chúa Tể Của Những Chiếc Nhẫn: Những Người Bạn Của Nhẫn,2001,178,8.8,92,"1,887,641",$315.54M,A meek Hobbit from the Shire and eight companions set out on a journey to destroy the powerful One Ring and save Middle-earth from the Dark Lord Sauron.,Peter Jackson,"['Elijah Wood', 'Ian McKellen', 'Orlando Bloom', 'Sean Bean']"
262,Cuộc Đời Forrest Gump,1994,142,8.8,82,"2,095,669",$330.25M,"The presidencies of Kennedy and Johnson, the Vietnam War, the Watergate scandal and other historical events unfold from the perspective of an Alabama man with an IQ of 75, whose only desire is to be reunited with his childhood sweetheart.",Robert Zemeckis,"['Tom Hanks', 'Robin Wright', 'Gary Sinise', 'Sally Field']"
263,Chúa Tể Của Những Chiếc Nhẫn: Hai Tòa Tháp,2002,179,8.8,87,"1,677,925",$342.55M,"While Frodo and Sam edge closer to Mordor with the help of the shifty Gollum, the divided fellowship makes a stand against Sauron's new ally, Saruman, and his hordes of Isengard.",Peter Jackson,"['Elijah Wood', 'Ian McKellen', 'Viggo Mortensen', 'Orlando Bloom']"
264,Jai Bhim,2021,164,8.8,^^^^^^,"203,964",*****,"When a tribal man is arrested for a case of alleged theft, his wife turns to a human-rights lawyer to help bring justice.",T.J. Gnanavel,"['Suriya', 'Lijo Mol Jose', 'Manikandan K.', 'Rajisha Vijayan']"
265,Rocketry: The Nambi Effect,2022,157,8.8,^^^^^^,"51,764",*****,"Based on the life of Indian Space Research Organization scientist Nambi Narayanan, who was framed for being a spy and arrested in 1994. Though free, he continues to fight for justice against the officials who falsely implicated him.",Madhavan,"['Madhavan', 'Simran', 'Rajit Kapoor', 'Ravi Raghavendra']"
266,Chiến Hữu,1990,145,8.7,91,"1,170,407",$46.84M,"The story of Henry Hill and his life in the mob, covering his relationship with his wife Karen Hill and his mob partners Jimmy Conway and Tommy DeVito in the Italian-American crime syndicate.",Martin Scorsese,"['Robert De Niro', 'Ray Liotta', 'Joe Pesci', 'Lorraine Bracco']"
267,Bay Trên Tổ Chim Cúc Cu,1975,133,8.7,84,"1,013,639",$112.00M,"In the Fall of 1963, a Korean War veteran and criminal pleads insanity and is admitted to a mental institution, where he rallies up the scared patients against the tyrannical nurse.",Milos Forman,"['Jack Nicholson', 'Louise Fletcher', 'Michael Berryman', 'Peter Brocco']"
268,The Kashmir Files,2022,170,8.7,^^^^^^,"562,897",*****,"A heart-wrenching tale that captures the pain, suffering, and struggle of the Kashmiri Pandit community in 1990 and leads Krishna, a young college student, to set out on a quest to uncover the truth.",Vivek Agnihotri,"['Mithun Chakraborty', 'Anupam Kher', 'Darshan Kumaar', 'Pallavi Joshi']"
269,Soorarai Pottru,2020,153,8.7,^^^^^^,"118,063",*****,"Nedumaaran Rajangam ""Maara"" sets out to make the common man fly and in the process takes on the world's most capital intensive industry and several enemies who stand in his way.",Sudha Kongara,"['Suriya', 'Prakash Belawadi', 'Aparna Balamurali', 'Paresh Rawal']"
270,Hố Đen Tử Thần,2014,169,8.6,74,"1,855,005",$188.02M,A team of explorers travel through a wormhole in space in an attempt to ensure humanity's survival.,Christopher Nolan,"['Matthew McConaughey', 'Anne Hathaway', 'Jessica Chastain', 'Mackenzie Foy']"
271,7 Tội Lỗi Chết Người,1995,127,8.6,65,"1,665,700",$100.13M,"Two detectives, a rookie and a veteran, hunt a serial killer who uses the seven deadly sins as his motives.",David Fincher,"['Morgan Freeman', 'Brad Pitt', 'Kevin Spacey', 'Andrew Kevin Walker']"
272,Sự Im Lặng Của Bầy Cừu,1991,118,8.6,85,"1,442,748",$130.74M,"A young F.B.I. cadet must receive the help of an incarcerated and manipulative cannibal killer to help catch another serial killer, a madman who skins his victims.",Jonathan Demme,"['Jodie Foster', 'Anthony Hopkins', 'Lawrence A. Bonney', 'Kasi Lemmons']"
273,Giải Cứu Binh Nhì Ryan,1998,169,8.6,91,"1,400,988",$216.54M,"Following the Normandy Landings, a group of U.S. soldiers go behind enemy lines to retrieve a paratrooper whose brothers have been killed in action.",Steven Spielberg,"['Tom Hanks', 'Matt Damon', 'Tom Sizemore', 'Edward Burns']"
274,Dặm Xanh,1999,189,8.6,61,"1,311,589",$136.80M,"The lives of guards on Death Row are affected by one of their charges: a black man accused of child murder and rape, yet who has a mysterious gift.",Frank Darabont,"['Tom Hanks', 'Michael Clarke Duncan', 'David Morse', 'Bonnie Hunt']"
275,Cuộc Sống Tươi Đẹp,1997,116,8.6,59,"700,475",$57.60M,"When an open-minded Jewish waiter and his son become victims of the Holocaust, he uses a perfect mixture of will, humor, and imagination to protect his son from the dangers around their camp.",Roberto Benigni,"['Roberto Benigni', 'Nicoletta Braschi', 'Giorgio Cantarini', 'Giustino Durano']"
276,Thành Phố Của Chúa,2002,130,8.6,79,"761,334",$7.56M,"In the slums of Rio, two kids' paths diverge as one struggles to become a photographer and the other a kingpin.","Directors:Fernando Meirelles, Kátia Lund","['Alexandre Rodrigues', 'Leandro Firmino', 'Matheus Nachtergaele', 'Phellipe Haagensen']"
277,Cuộc Sống Tươi Đẹp,1946,130,8.6,89,"466,123",*****,An angel is sent from Heaven to help a desperately frustrated businessman by showing him what life would have been like if he had never existed.,Frank Capra,"['James Stewart', 'Donna Reed', 'Lionel Barrymore', 'Thomas Mitchell']"
278,Bảy Võ Sĩ Đạo,1954,207,8.6,98,"348,346",$0.27M,"Farmers from a village exploited by bandits hire a veteran samurai for protection, who gathers six other samurai to join him.",Akira Kurosawa,"['Toshirô Mifune', 'Takashi Shimura', 'Keiko Tsushima', 'Yukiko Shimazaki']"
279,Sita Ramam,2022,163,8.6,^^^^^^,"55,375",*****,"An orphan soldier, Lieutenant Ram's life changes, after he gets a letter from a girl named Sita. He meets her and love blossoms between them. When he comes back to his camp in Kashmir,After he gets caught in jail, he sends a letter to Sita which won't reach her.",Hanu Raghavapudi,"['Dulquer Salmaan', 'Mrunal Thakur', 'Rashmika Mandanna', 'Sumanth']"
280,Seppuku,1962,133,8.6,85,"58,775",*****,"When a ronin requesting seppuku at a feudal lord's palace is told of the brutal suicide of another ronin who previously visited, he reveals how their pasts are intertwined - and in doing so challenges the clan's integrity.",Masaki Kobayashi,"['Tatsuya Nakadai', 'Akira Ishihama', 'Shima Iwashita', 'Tetsurô Tanba']"
281,Tay Trống Cự Phách,2014,106,8.5,89,"875,581",$13.09M,A promising young drummer enrolls at a cut-throat music conservatory where his dreams of greatness are mentored by an instructor who will stop at nothing to realize a student's potential.,Damien Chazelle,"['Miles Teller', 'J.K. Simmons', 'Melissa Benoist', 'Paul Reiser']"
282,Ký Sinh Trùng,2019,132,8.5,96,"819,371",$53.37M,Greed and class discrimination threaten the newly formed symbiotic relationship between the wealthy Park family and the destitute Kim clan.,Bong Joon Ho,"['Song Kang-ho', 'Lee Sun-kyun', 'Cho Yeo-jeong', 'Choi Woo-sik']"
283,Võ Sĩ Giác Đấu,2000,155,8.5,67,"1,511,029",$187.71M,A former Roman General sets out to exact vengeance against the corrupt emperor who murdered his family and sent him into slavery.,Ridley Scott,"['Russell Crowe', 'Joaquin Phoenix', 'Connie Nielsen', 'Oliver Reed']"
284,Điệp Vụ Boston,2006,151,8.5,85,"1,334,299",$132.38M,An undercover cop and a mole in the police attempt to identify each other while infiltrating an Irish gang in South Boston.,Martin Scorsese,"['Leonardo DiCaprio', 'Matt Damon', 'Jack Nicholson', 'Mark Wahlberg']"
285,Léon: Sát Thủ Chuyên Nghiệp,1994,110,8.5,64,"1,170,168",$19.50M,"12-year-old Mathilda is reluctantly taken in by Léon, a professional assassin, after her family is murdered. An unusual relationship forms as she becomes his protégée and learns the assassin's trade.",Luc Besson,"['Jean Reno', 'Gary Oldman', 'Natalie Portman', 'Danny Aiello']"
286,Ảo Thuật Gia Đấu Trí,2006,130,8.5,66,"1,342,825",$53.09M,"After a tragic accident, two stage magicians in 1890s London engage in a battle to create the ultimate illusion while sacrificing everything they have to outwit each other.",Christopher Nolan,"['Christian Bale', 'Hugh Jackman', 'Scarlett Johansson', 'Michael Caine']"
287,Lời Sấm Truyền,1979,147,8.5,94,"672,657",$83.47M,A U.S. Army officer serving in Vietnam is tasked with assassinating a renegade Special Forces Colonel who sees himself as a god.,Francis Ford Coppola,"['Martin Sheen', 'Marlon Brando', 'Robert Duvall', 'Frederic Forrest']"
288,Vua Sư Tử,1994,88,8.5,88,"1,066,590",$422.78M,"Lion prince Simba and his father are targeted by his bitter uncle, who wants to ascend the throne himself.","Directors:Roger Allers, Rob Minkoff","['Matthew Broderick', 'Jeremy Irons', 'James Earl Jones', 'Whoopi Goldberg']"
289,Nghi Phạm Vô Hình,1995,106,8.5,77,"1,091,590",$23.34M,"A sole survivor tells of the twisty events leading up to a horrific gun battle on a boat, which began when five criminals met at a seemingly random police lineup.",Bryan Singer,"['Kevin Spacey', 'Gabriel Byrne', 'Chazz Palminteri', 'Stephen Baldwin']"
290,Lịch Sử Mĩ Thế Kỉ X,1998,119,8.5,62,"1,129,259",$6.72M,A former neo-nazi skinhead tries to prevent his younger brother from going down the same wrong path that he did.,Tony Kaye,"['Edward Norton', 'Edward Furlong', ""Beverly D'Angelo"", 'Jennifer Lien']"
291,Nghệ Sĩ Dương Cầm,2002,150,8.5,85,"839,482",$32.57M,A Polish Jewish musician struggles to survive the destruction of the Warsaw ghetto of World War II.,Roman Polanski,"['Adrien Brody', 'Thomas Kretschmann', 'Frank Finlay', 'Emilia Fox']"
292,Chuyện Tình Thế Chiến,1942,102,8.5,100,"575,656",$1.02M,A cynical expatriate American cafe owner struggles to decide whether or not to help his former lover and her fugitive husband escape the Nazis in French Morocco.,Michael Curtiz,"['Humphrey Bogart', 'Ingrid Bergman', 'Paul Henreid', 'Claude Rains']"
293,Những Kẻ Bên Lề,2011,112,8.5,57,"866,085",$13.18M,"After he becomes a quadriplegic from a paragliding accident, an aristocrat hires a young man from the projects to be his caregiver.","Directors:Olivier Nakache, Éric Toledano","['François Cluzet', 'Omar Sy', 'Anne Le Ny', 'Audrey Fleurot']"
294,Mộ Đom Đóm,1988,89,8.5,94,"280,848",*****,A young boy and his little sister struggle to survive in Japan during World War II.,Isao Takahata,"['Tsutomu Tatsumi', 'Ayano Shiraishi', 'Akemi Yamaguchi', 'Yoshiko Shinohara']"
295,Rạp Chiếu Bóng Thiên Đường,1988,155,8.5,80,"263,740",$11.99M,A filmmaker recalls his childhood when falling in love with the pictures at the cinema of his home village and forms a deep friendship with the cinema's projectionist.,Giuseppe Tornatore,"['Philippe Noiret', 'Enzo Cannavale', 'Antonella Attili', 'Isa Danieli']"
296,Thời Hiện Đại,1936,87,8.5,96,"244,767",$0.16M,The Tramp struggles to live in modern industrial society with the help of a young homeless woman.,Charles Chaplin,"['Charles Chaplin', 'Paulette Goddard', 'Henry Bergman', 'Tiny Sandford']"
297,Ánh Sáng Đô Thị,1931,87,8.5,99,"186,277",$0.02M,"With the aid of a wealthy erratic tippler, a dewy-eyed tramp who has fallen in love with a sightless flower girl accumulates money to be able to help her medically.",Charles Chaplin,"['Charles Chaplin', 'Virginia Cherrill', 'Florence Lee', 'Harry Myers']"
298,96,II 2018,158,8.5,^^^^^^,"32,232",*****,Two high school sweethearts meet at a reunion after 22 years and reminisce about their past.,C. Prem Kumar,"['Vijay Sethupathi', 'Adithya Bhaskar', 'Trisha Krishnan', 'Gouri Kishan']"
299,Avengers: Hồi Kết,2019,181,8.4,78,"1,145,628",$858.37M,"After the devastating events of Avengers: Cuộc Chiến Vô Cực (2018), the universe is in ruins. With the help of remaining allies, the Avengers assemble once more in order to reverse Thanos' actions and restore balance to the universe.","Directors:Anthony Russo, Joe Russo","['Robert Downey Jr.', 'Chris Evans', 'Mark Ruffalo', 'Chris Hemsworth']"
300,Vùng Đất Linh Hồn,2001,125,8.6,96,"771,525",$10.06M,"During her family's move to the suburbs, a sullen 10-year-old girl wanders into a world ruled by gods, witches, and spirits, and where humans are changed into beasts.",Hayao Miyazaki,"['Daveigh Chase', 'Suzanne Pleshette', 'Miyu Irino', 'Rumi Hiiragi']"
301,Cuộc Sống Tươi Đẹp,1946,130,8.6,89,"466,123",*****,An angel is sent from Heaven to help a desperately frustrated businessman by showing him what life would have been like if he had never existed.,Frank Capra,"['James Stewart', 'Donna Reed', 'Lionel Barrymore', 'Thomas Mitchell']"
302,Vua Sư Tử,1994,88,8.5,88,"1,066,590",$422.78M,"Lion prince Simba and his father are targeted by his bitter uncle, who wants to ascend the throne himself.","Directors:Roger Allers, Rob Minkoff","['Matthew Broderick', 'Jeremy Irons', 'James Earl Jones', 'Whoopi Goldberg']"
303,Người Nhện: Vũ Trụ Mới,2018,117,8.4,87,"539,908",$190.24M,"Teen Miles Morales becomes the Spider-Man of his universe, and must join with five spider-powered individuals from other dimensions to stop a threat for all realities.","Directors:Bob Persichetti, Peter Ramsey, Rodney Rothman","['Shameik Moore', 'Jake Johnson', 'Hailee Steinfeld', 'Mahershala Ali']"
304,Coco: Hội Ngộ Diệu Kỳ,I 2017,105,8.4,81,"517,136",$209.73M,"Aspiring musician Miguel, confronted with his family's ancestral ban on music, enters the Land of the Dead to find his great-great-grandfather, a legendary singer.","Directors:Lee Unkrich, Adrian Molina","['Anthony Gonzalez', 'Gael García Bernal', 'Benjamin Bratt', 'Alanna Ubach']"
305,Rô-bốt Biết Yêu,2008,98,8.4,95,"1,124,269",$223.81M,"In the distant future, a small waste-collecting robot inadvertently embarks on a space journey that will ultimately decide the fate of mankind.",Andrew Stanton,"['Ben Burtt', 'Elissa Knight', 'Jeff Garlin', 'Fred Willard']"
306,Vút Bay,2009,96,8.3,88,"1,051,952",$293.00M,"78-year-old Carl Fredricksen travels to Paradise Falls in his house equipped with balloons, inadvertently taking a young stowaway.","Directors:Pete Docter, Bob Peterson","['Edward Asner', 'Jordan Nagai', 'John Ratzenberger', 'Christopher Plummer']"
307,Câu Chuyện Đồ Chơi,1995,81,8.3,96,"1,001,336",$191.80M,A cowboy doll is profoundly threatened and jealous when a new spaceman action figure supplants him as top toy in a boy's bedroom.,John Lasseter,"['Tom Hanks', 'Tim Allen', 'Don Rickles', 'Jim Varney']"
308,Câu Chuyện Đồ Chơi 3,2010,103,8.3,92,"842,383",$415.00M,"The toys are mistakenly delivered to a day-care center instead of the attic right before Andy leaves for college, and it's up to Woody to convince the other toys that they weren't abandoned and to return home.",Lee Unkrich,"['Tom Hanks', 'Tim Allen', 'Joan Cusack', 'Ned Beatty']"
309,Cậu Bé Đặc Biệt,2007,165,8.3,^^^^^^,"195,214",$1.22M,"An eight-year-old boy is thought to be a lazy trouble-maker, until the new art teacher has the patience and compassion to discover the real problem behind his struggles in school.","Directors:Aamir Khan, Amole Gupte","['Darsheel Safary', 'Aamir Khan', 'Tisca Chopra', 'Vipin Sharma']"
310,Đứa Trẻ,1921,68,8.3,^^^^^^,"127,650",$5.45M,"The Tramp cares for an abandoned child, but events put their relationship in jeopardy.",Charles Chaplin,"['Charles Chaplin', 'Edna Purviance', 'Jackie Coogan', 'Carl Miller']"
311,Lâu Đài Di Động Của Howl,2004,119,8.2,80,"401,003",$4.71M,"When an unconfident young woman is cursed with an old body by a spiteful witch, her only chance of breaking the spell lies with a self-indulgent yet insecure young wizard and his companions in his legged, walking castle.",Hayao Miyazaki,"['Chieko Baisho', 'Takuya Kimura', 'Tatsuya Gashûin', 'Akihiro Miwa']"
312,Những Mảnh Ghép Cảm Xúc,I 2015,95,8.2,94,"721,547",$356.46M,"After young Riley is uprooted from her Midwest life and moved to San Francisco, her emotions - Joy, Fear, Anger, Disgust and Sadness - conflict on how best to navigate a new city, house, and school.","Directors:Pete Docter, Ronnie Del Carmen","['Amy Poehler', 'Bill Hader', 'Lewis Black', 'Mindy Kaling']"
313,Đi Tìm Nemo,2003,100,8.2,90,"1,051,316",$380.84M,"After his son is captured in the Great Barrier Reef and taken to Sydney, a timid clownfish sets out on a journey to bring him home.","Directors:Andrew Stanton, Lee Unkrich","['Albert Brooks', 'Ellen DeGeneres', 'Alexander Gould', 'Willem Dafoe']"
314,Klaus - Câu Chuyện Giáng Sinh,2019,96,8.2,65,"161,675",*****,"A simple act of kindness always sparks another, even in a frozen, faraway place. When Smeerensburg's new postman, Jesper, befriends toymaker Klaus, their gifts melt an age-old feud and deliver a sleigh full of holiday traditions.","Directors:Sergio Pablos, Carlos Martínez López","['Jason Schwartzman', 'J.K. Simmons', 'Rashida Jones', 'Will Sasso']"
315,Những Đứa Trẻ Thiên Đường,1997,89,8.2,77,"75,495",$0.93M,"After a boy loses his sister's pair of shoes, he goes on a series of adventures in order to find them. When he can't, he tries a new way to ""win"" a new pair.",Majid Majidi,"['Mohammad Amir Naji', 'Amir Farrokh Hashemian', 'Bahare Seddiqi', 'Nafise Jafar-Mohammadi']"
316,Cha Và Con Của Tôi,2005,112,8.2,^^^^^^,"87,247",*****,The family of a left-wing journalist is torn apart after the military coup of Turkey in 1980.,Çagan Irmak,"['Çetin Tekindor', 'Fikret Kuskan', 'Hümeyra', 'Ege Tanman']"
317,Harry Potter và Bảo Bối Tử Thần: Phần 2,2011,130,8.1,85,"884,208",$381.01M,"Harry, Ron, and Hermione search for Voldemort's remaining Horcruxes in their effort to destroy the Dark Lord as the final battle rages on at Hogwarts.",David Yates,"['Daniel Radcliffe', 'Emma Watson', 'Rupert Grint', 'Michael Gambon']"
318,Chú Chuột Đầu Bếp,2007,111,8.1,96,"747,459",$206.45M,A rat who can cook makes an unusual alliance with a young kitchen worker at a famous Paris restaurant.,"Directors:Brad Bird, Jan Pinkava","['Brad Garrett', 'Lou Romano', 'Patton Oswalt', 'Ian Holm']"
319,Phù Thủy Xứ Oz,1939,102,8.1,92,"404,659",$2.08M,"Young Dorothy Gale and her dog Toto are swept away by a tornado from their Kansas farm to the magical Land of Oz, and embark on a quest with three new friends to see the Wizard, who can return her to her home and fulfill the others' wishes.","Directors:Victor Fleming, George Cukor, Mervyn LeRoy, Norman Taurog, Richard Thorpe, King Vidor","['Judy Garland', 'Frank Morgan', 'Ray Bolger', 'Bert Lahr']"
320,Giai Điệu Hạnh Phúc,1965,172,8.1,63,"239,728",$163.21M,A young novice is sent by her convent in 1930s Austria to become a governess to the seven children of a widowed naval officer.,Robert Wise,"['Julie Andrews', 'Christopher Plummer', 'Eleanor Parker', 'Richard Haydn']"
321,Công Ty Quái Vật,2001,92,8.1,79,"917,047",$289.92M,"In order to power the city, monsters have to scare children so that they scream. However, the children are toxic to the monsters, and after a child gets through, two monsters realize things may not be what they think.","Directors:Pete Docter, David Silverman, Lee Unkrich","['Billy Crystal', 'John Goodman', 'Mary Gibbs', 'Steve Buscemi']"
322,Bí Kíp Luyện Rồng,2010,98,8.1,75,"747,612",$217.58M,"A hapless young Viking who aspires to hunt dragons becomes the unlikely friend of a young dragon himself, and learns there may be more to the creatures than he assumed.","Directors:Dean DeBlois, Chris Sanders","['Jay Baruchel', 'Gerard Butler', 'Christopher Mintz-Plasse', 'Craig Ferguson']"
323,Hachiko: Chú Chó Trung Thành,2009,93,8.1,^^^^^^,"289,517",*****,A college professor bonds with an abandoned dog he takes into his home.,Lasse Hallström,"['Richard Gere', 'Joan Allen', 'Cary-Hiroyuki Tagawa', 'Sarah Roemer']"
